transcription,audio
is like you open a joint account tell me about processes,download/automatic_speech_recognition/en/train/0.wav
can you help me set up a joint bank account,download/automatic_speech_recognition/en/train/1.wav
how to set up a joint account,download/automatic_speech_recognition/en/train/2.wav
Henry County set up a joint account with my wife and where are they at,download/automatic_speech_recognition/en/train/3.wav
I would like to set up a joint account with my partner,download/automatic_speech_recognition/en/train/4.wav
hi I'd like to set up a joint account with my partner I'm not seeing the option to do it on the app so I called in to get some help can I do it over the phone with you and give you the information,download/automatic_speech_recognition/en/train/5.wav
can I have an account with my sister I want to set up a joint account,download/automatic_speech_recognition/en/train/6.wav
I need to find out if I probably set up a joint account,download/automatic_speech_recognition/en/train/7.wav
